{
  "eventId": "65bb1e35-ab5c-4271-a7c7-4d498a9abb5a",
  "eventType": "run.queued",
  "occurredAt": "2026-08-02T10:00:00.000Z",
  "runId": "d66b85c4-f327-454c-9de3-d50723980f91",
  "schemaVersion": "1.0.0",
  "correlationId": "request-01",
  "causationId": null,
  "payload": {
    "journeyVersionId": "76a64e58-e8e0-489f-850a-e698e0648460",
    "personaCount": 2
  }
}
